_id,index,age,eyeColor,name,gender,company,email,phone,number,street,city,state,zipcode,about,registered,latitude,longitude,tags
5aa252be6b50e78c58d6d851,44,20,blue,Fletcher Anderson,male,MOBILDATA,fletcheranderson@mobildata.com,+1 (947) 464-3676,258,Folsom Place,Calverton,Missouri,106,Nulla qui proident est cupidatat est fugiat. Sunt esse sunt ut in. Amet cupidatat non adipisicing voluptate do Lorem commodo. Commodo nulla ea aute elit magna cupidatat cupidatat non Lorem ex. Exercitation aliquip sint magna sunt amet ad duis exercitation. Labore consequat officia qui qui aliqua sit eu irure consectetur cupidatat. Enim velit dolor adipisicing enim.,2017-06-19T09:51:36 -06:-30,-77.474666,130.016173,"incididunt,exercitation,pariatur,velit,pariatur,est,sunt"
5aa252bec718bb2b3aaeb803,45,21,blue,Acevedo Ashley,male,EVENTAGE,acevedoashley@eventage.com,+1 (964) 477-2828,935,Wythe Place,Basye,Oklahoma,110,Non dolore tempor ullamco sunt sit dolor reprehenderit. Culpa ut tempor labore duis consequat in laborum elit. Nostrud sunt proident aliqua cillum ex quis ipsum do dolor.,2015-11-23T08:21:03 -06:-30,-42.304294,-4.820778,"laborum,ut,veniam,Lorem,cillum,voluptate,cillum"
5aa252be69712efd37d5584c,46,20,brown,Maxwell Buchanan,male,EVENTIX,maxwellbuchanan@eventix.com,+1 (975) 503-3389,429,Middagh Street,Longbranch,Connecticut,105,Nulla consequat culpa sit aute commodo sunt voluptate pariatur et. Duis minim eiusmod incididunt labore eu adipisicing irure ut minim. Non excepteur est cillum consectetur ut magna minim. Ex anim occaecat consectetur Lorem proident ex sit aute ullamco.,2014-12-13T01:17:52 -06:-30,-6.126899,54.060092,"adipisicing,eiusmod,eiusmod,in,occaecat,reprehenderit,sunt"
5aa252be5cad24b578cc0699,47,35,green,Sophia Hunt,female,ROTODYNE,sophiahunt@rotodyne.com,+1 (874) 471-3441,912,Cameron Court,Kapowsin,Northern Mariana Islands,109,Irure amet ad aliqua ullamco ut ipsum consectetur qui elit. Incididunt qui minim fugiat sit ut dolor enim. Ipsum aliqua cupidatat commodo elit laborum. Labore tempor reprehenderit minim veniam ex culpa id non aute. Ut Lorem cillum consectetur dolore magna adipisicing esse sunt mollit quis aliquip.,2015-01-03T03:07:11 -06:-30,-64.797096,-16.191427,"do,mollit,dolore,amet,elit,sunt,in"
5aa252be30ba470bee649350,48,35,brown,Rachel Tanner,female,CONJURICA,racheltanner@conjurica.com,+1 (874) 445-3248,156,Jardine Place,Hessville,Iowa,100,Aliquip laboris occaecat reprehenderit et esse nostrud adipisicing nostrud consectetur. Qui voluptate labore ipsum qui ex exercitation aliqua nulla labore est proident laborum. Exercitation dolore ipsum dolor aliqua dolor labore do.,2017-08-28T05:33:58 -06:-30,81.453944,-37.680755,"elit,ipsum,consectetur,culpa,laborum,duis,adipisicing"
5aa252be1bead96cffa354dc,49,33,green,Henderson Cobb,male,ONTALITY,hendersoncobb@ontality.com,+1 (911) 507-3236,755,Varet Street,Lorraine,Mississippi,102,Deserunt dolore veniam esse aliquip aute laborum dolor veniam do ullamco. Ea qui pariatur dolore eiusmod duis sint irure elit. Nostrud aliquip culpa fugiat qui consectetur ad et. Magna commodo pariatur officia tempor minim culpa. Incididunt in ea cillum officia.,2016-11-26T10:40:40 -06:-30,-59.244886,-129.452348,"qui,dolor,voluptate,velit,sit,ipsum,reprehenderit"
5aa252be2c706eec131edafc,50,35,green,Charity Mayo,female,GEOFORM,charitymayo@geoform.com,+1 (920) 412-2507,195,Covert Street,Harborton,Virgin Islands,101,Mollit in id culpa ex duis do minim labore cupidatat laboris commodo. Cillum aliqua veniam excepteur ea Lorem. Amet enim in tempor dolore aliqua culpa nisi qui tempor aliqua mollit enim.,2015-07-24T12:44:43 -06:-30,27.69631,-86.241638,"dolore,aute,aliquip,labore,ullamco,laborum,quis"
5aa252beae525ff2f99726b3,51,23,green,Manuela Petty,female,ZENTHALL,manuelapetty@zenthall.com,+1 (876) 478-2004,119,Gerald Court,Gordon,Guam,107,Ea ullamco commodo exercitation culpa consectetur officia Lorem. Dolore laborum adipisicing veniam cillum minim officia elit. Ex occaecat eiusmod reprehenderit ullamco laborum eiusmod aliqua officia. Voluptate nulla fugiat id aute. Eiusmod cupidatat laboris veniam proident cupidatat tempor reprehenderit consectetur voluptate eu in quis magna officia. Minim labore nulla anim veniam.,2016-05-08T08:08:17 -06:-30,64.661616,-83.724704,"cillum,nulla,nostrud,minim,ex,proident,Lorem"
5aa252bea12e32ed1206d064,52,28,blue,Salazar Burns,male,PHORMULA,salazarburns@phormula.com,+1 (891) 529-2139,161,Vermont Court,Websterville,Kentucky,102,Incididunt minim ullamco velit in mollit do proident est do voluptate do duis. Cupidatat veniam eu tempor enim laborum ipsum aute ullamco. Exercitation excepteur magna ad incididunt labore enim officia qui consequat nisi. Proident veniam consequat eiusmod Lorem irure do cupidatat duis eiusmod non nulla dolor laborum. Ex tempor ea ad ex consequat cillum mollit enim in.,2018-01-30T02:43:52 -06:-30,-26.627376,-0.512908,"adipisicing,consectetur,mollit,adipisicing,incididunt,cillum,minim"
5aa252becf452dfa1e9f736e,53,33,green,Allison Savage,male,PHARMEX,allisonsavage@pharmex.com,+1 (894) 443-3212,750,Greenwood Avenue,Avoca,New Hampshire,110,Ut consectetur Lorem qui et sint ut adipisicing veniam sint nisi. Exercitation ea nostrud nulla velit. Nisi dolore officia ex nulla Lorem cupidatat.,2014-11-14T10:39:45 -06:-30,-75.624303,60.671798,"ut,nulla,reprehenderit,dolore,aute,sunt,esse"
5aa252be1c3674bd569d1466,54,39,blue,Hattie Knowles,female,ZOLAVO,hattieknowles@zolavo.com,+1 (945) 428-3037,737,Russell Street,Suitland,North Carolina,107,Mollit duis adipisicing amet eiusmod duis ipsum. Sint officia duis reprehenderit nulla ea labore veniam et dolore ipsum eiusmod. Et labore adipisicing duis laborum magna et reprehenderit excepteur laboris culpa labore aliqua ea aliquip.,2014-02-17T05:50:18 -06:-30,33.510816,159.54175,"deserunt,ea,et,anim,incididunt,culpa,deserunt"
5aa252bed2069522d5f5a789,55,37,brown,Mays Cortez,male,NEOCENT,mayscortez@neocent.com,+1 (933) 516-2821,297,Martense Street,Nogal,Virginia,100,Dolore reprehenderit incididunt nostrud in elit incididunt in. Et sint in ea dolor eiusmod in commodo exercitation elit ut incididunt et anim minim. Reprehenderit laborum cillum pariatur elit dolore.,2017-10-02T09:35:44 -06:-30,-54.679098,-97.925222,"amet,et,consectetur,dolor,id,fugiat,eu"
5aa252be5a7018767dcb7b72,56,37,brown,Alma Becker,female,EXERTA,almabecker@exerta.com,+1 (878) 457-3726,100,Flatlands Avenue,Glenbrook,Nevada,103,Minim pariatur excepteur et ullamco aliquip ut laboris irure minim adipisicing elit magna amet ad. Aliquip officia incididunt eu excepteur ad anim qui anim. Lorem in tempor sint cupidatat in laborum nostrud ullamco occaecat. Ex do aute deserunt sunt ipsum elit tempor et tempor laboris officia excepteur excepteur. Adipisicing Lorem sunt sit dolor irure. Deserunt occaecat amet tempor ea. Velit nulla pariatur ipsum eu esse veniam voluptate officia labore dolor occaecat.,2016-05-09T05:38:04 -06:-30,-83.28486,61.012753,"deserunt,est,aliqua,labore,officia,officia,mollit"
5aa252bedad738b26025ea28,57,23,brown,Galloway Blackburn,male,SULTRAX,gallowayblackburn@sultrax.com,+1 (805) 579-2488,957,Dumont Avenue,Harmon,Massachusetts,104,Aliquip do proident aliquip duis exercitation est tempor irure irure ipsum. Do commodo minim anim nostrud est minim ea ea deserunt aute elit non id. Labore et commodo quis dolor ut pariatur esse sunt cupidatat duis anim adipisicing in enim. Ut consectetur ut et adipisicing.,2014-05-17T10:21:37 -06:-30,62.248078,-81.796458,"sit,aliqua,do,excepteur,nisi,veniam,pariatur"
5aa252beab8bcfa4c523167e,58,31,blue,Richardson Blake,male,QUALITERN,richardsonblake@qualitern.com,+1 (849) 591-3857,718,Willoughby Avenue,Enetai,Georgia,108,Officia consequat pariatur do fugiat laboris. Mollit consequat proident fugiat id ad aute commodo cupidatat consequat nulla. Aliquip fugiat tempor ad aliqua in aliqua do et veniam excepteur aliquip tempor ipsum. Elit Lorem officia aliquip consequat sint dolore duis non labore id laborum exercitation ea amet. Deserunt culpa adipisicing sunt exercitation ipsum proident occaecat commodo fugiat exercitation quis sit. Sit officia duis nostrud proident eu anim pariatur ex laborum sit dolor reprehenderit. Consequat id in et nostrud exercitation velit non amet id id adipisicing dolore.,2017-05-02T05:00:43 -06:-30,58.055432,30.476183,"deserunt,aute,magna,id,amet,duis,occaecat"
5aa252bee7ef1b8d32d532ce,59,26,brown,Rodriguez Holloway,male,NAVIR,rodriguezholloway@navir.com,+1 (960) 576-3048,326,Kimball Street,Belmont,New Jersey,107,Incididunt anim ullamco eu ipsum non Lorem est eiusmod fugiat mollit magna Lorem nisi. Occaecat eiusmod do deserunt qui laborum adipisicing exercitation anim velit ullamco. Do pariatur elit consectetur consequat. Aliquip magna ipsum cillum pariatur exercitation ex elit. Irure tempor mollit sunt officia nisi nisi duis minim occaecat do consequat irure id voluptate.,2015-12-19T05:58:56 -06:-30,-46.808866,-83.137773,"reprehenderit,aliquip,reprehenderit,cupidatat,nisi,ullamco,dolore"
5aa252bed7adb4dab201399c,60,37,green,Rhea Kent,female,ELECTONIC,rheakent@electonic.com,+1 (834) 518-2762,988,Canarsie Road,Hegins,American Samoa,107,Eiusmod do ad consectetur incididunt quis sunt in laboris culpa velit sint esse commodo. Non dolor laboris enim id sunt aute duis laborum aute est id id. Aliqua reprehenderit enim nulla amet aliquip laborum irure qui aliquip quis nostrud laborum ad. Excepteur dolore officia voluptate culpa aliquip ex officia adipisicing occaecat commodo reprehenderit in adipisicing nulla. Sunt laboris excepteur mollit quis. Ex in excepteur esse commodo sunt ipsum in labore.,2017-03-13T05:52:47 -06:-30,28.334803,-130.496241,"ex,deserunt,deserunt,cillum,laborum,dolor,occaecat"
5aa252beca3ab381a1d61e3a,61,20,brown,Graciela Shaw,female,QUORDATE,gracielashaw@quordate.com,+1 (910) 515-2841,759,Brightwater Court,Jugtown,California,102,Ipsum non ullamco consequat nulla. Labore aliquip commodo nulla esse id aliqua occaecat et nostrud ipsum duis aliqua. Sit reprehenderit anim nostrud dolore irure quis mollit non incididunt voluptate nulla aute officia. Esse do labore dolor officia ullamco nostrud fugiat sit consectetur nostrud nostrud ad proident. Id qui proident nostrud ad anim eiusmod laborum excepteur anim proident magna pariatur esse irure. Non adipisicing esse ex occaecat.,2015-08-12T05:28:09 -06:-30,-61.313572,14.243827,"non,occaecat,cupidatat,aute,cillum,aliquip,minim"
5aa252bea721a6c274301bee,62,28,brown,Concepcion Whitfield,female,QUIZKA,concepcionwhitfield@quizka.com,+1 (969) 406-2277,830,Narrows Avenue,Farmington,New Mexico,102,Ipsum irure voluptate est exercitation laboris quis. Deserunt consectetur culpa qui pariatur occaecat officia fugiat. Proident reprehenderit Lorem sunt ullamco aliquip eiusmod in excepteur amet sint et ipsum pariatur. Velit dolore occaecat duis sit sit sit. Eiusmod aliquip proident est ipsum elit excepteur quis eiusmod aute incididunt minim ipsum.,2015-03-26T03:50:19 -06:-30,29.674994,50.634487,"laborum,cillum,dolor,tempor,exercitation,ullamco,laboris"
5aa252be1827d1a228695197,63,27,green,Conrad Tran,male,ZOID,conradtran@zoid.com,+1 (938) 522-2776,559,Alice Court,Mooresburg,Wyoming,106,Aliquip enim aliqua do do dolore proident Lorem tempor. Consectetur minim pariatur deserunt nisi. Adipisicing minim voluptate excepteur ipsum deserunt dolore. Esse sit pariatur exercitation sunt proident pariatur cupidatat consequat sunt veniam dolor veniam et duis. Mollit incididunt aliqua commodo dolore veniam pariatur laborum aute anim officia voluptate ut.,2015-09-25T09:52:53 -06:-30,84.896733,13.115154,"deserunt,duis,ipsum,cillum,sit,velit,laborum"
5aa252bebc26237a5cf7384d,64,36,green,Sherrie Bell,female,MEDICROIX,sherriebell@medicroix.com,+1 (956) 421-2629,745,Lawrence Avenue,Bend,Washington,110,Ullamco aliqua pariatur tempor reprehenderit nulla laboris excepteur. Esse adipisicing ex Lorem sint aute aute nostrud aliquip ipsum ex est dolore. Proident magna aliqua reprehenderit aliquip culpa nulla aliqua. Magna ut eiusmod nisi incididunt commodo commodo irure sunt. Qui incididunt aute ipsum sunt incididunt quis magna irure. Anim velit nulla id do non pariatur.,2017-03-30T01:25:58 -06:-30,45.28078,-44.946374,"eu,aute,ullamco,Lorem,commodo,id,exercitation"
5aa252be70ba4dda9a4a5a6c,65,29,brown,Steele Gonzales,male,DYMI,steelegonzales@dymi.com,+1 (913) 483-2911,649,Lorraine Street,Connerton,Delaware,108,Minim dolore aute ea dolore laboris mollit cillum ut et sunt esse consequat deserunt labore. Voluptate amet commodo nostrud anim exercitation in velit. Labore ad fugiat proident id sit voluptate enim incididunt id aliqua dolor. Ea officia enim sunt consectetur Lorem incididunt incididunt esse officia est. Laboris Lorem do ut ex sint proident laboris amet veniam velit duis.,2017-02-20T02:00:24 -06:-30,-7.69749,-101.355208,"velit,aliqua,nisi,dolore,sit,proident,duis"
5aa252bebc75150fd49a5951,66,28,green,Claudette Norris,female,VERAQ,claudettenorris@veraq.com,+1 (979) 496-3225,553,Goodwin Place,Chalfant,Nebraska,110,Velit duis dolor ex Lorem id. Lorem amet ex aliqua magna commodo nostrud. Culpa et pariatur reprehenderit tempor qui sit eu adipisicing sint culpa incididunt proident officia nisi.,2016-10-27T03:30:49 -06:-30,87.939077,-19.419072,"officia,velit,elit,pariatur,velit,minim,anim"
5aa252be37af1370412ea635,67,36,brown,Waller Spencer,male,LIMOZEN,wallerspencer@limozen.com,+1 (868) 511-2280,782,Veranda Place,Datil,Maine,103,Ipsum enim qui proident laboris et. Anim anim irure aliquip et qui in nisi excepteur irure irure in mollit dolore proident. Consectetur est amet do voluptate elit. Cillum mollit voluptate sit ipsum. Id cupidatat dolore aliqua deserunt.,2014-05-02T03:26:28 -06:-30,-48.14483,-154.144112,"consequat,sint,minim,amet,ullamco,nisi,proident"
5aa252beb144eb6392d25f33,68,39,blue,Drake Dotson,male,COMTEST,drakedotson@comtest.com,+1 (935) 542-3532,394,Cherry Street,Yorklyn,Palau,103,Deserunt sunt non do anim. Fugiat fugiat sunt ut anim pariatur anim consequat. Labore culpa id ad pariatur laborum cupidatat eiusmod aliqua laboris. Voluptate tempor esse ad tempor reprehenderit aliqua enim ea ut consectetur Lorem culpa ipsum. Dolor anim exercitation quis exercitation dolore do eu cupidatat nisi elit quis eiusmod.,2014-04-15T04:30:58 -06:-30,29.849533,-1.564299,"tempor,consequat,officia,duis,adipisicing,aute,laboris"
5aa252be357f450e727dfbc5,69,40,green,Suzanne Johnston,female,IMANT,suzannejohnston@imant.com,+1 (992) 477-3159,770,Dakota Place,Curtice,Tennessee,103,Officia consequat eiusmod aliquip deserunt consequat ipsum. Nostrud reprehenderit sit veniam anim et sunt aliquip labore ullamco proident id. Officia do aliquip et exercitation excepteur incididunt officia ad. Qui amet occaecat consectetur fugiat quis ut officia dolore mollit ut minim eiusmod in eiusmod.,2015-02-15T06:37:14 -06:-30,-85.567299,127.26124,"consectetur,exercitation,sunt,consequat,in,esse,qui"
5aa252bea411e4f2bbf1d11a,70,23,brown,Rios Gray,male,ZIDANT,riosgray@zidant.com,+1 (920) 500-3717,748,Bank Street,Coalmont,Arizona,101,In incididunt do labore non ea dolore anim sint quis voluptate voluptate Lorem. Cupidatat exercitation eiusmod laboris commodo occaecat ut nostrud id. Est exercitation dolore consequat tempor amet consectetur non laboris culpa mollit dolor. Cillum ea amet occaecat dolor. Dolor veniam labore mollit nisi enim fugiat voluptate ea occaecat. Irure incididunt est proident laboris proident sint et aliqua exercitation laboris ad nostrud. Ut non mollit id cillum qui et do sit quis.,2016-09-22T01:17:46 -06:-30,-27.118388,109.910452,"irure,nisi,sunt,id,mollit,nulla,eiusmod"
5aa252bef2bf7fb2450c8675,71,22,green,Gwen Mitchell,female,UNCORP,gwenmitchell@uncorp.com,+1 (856) 523-2856,990,Pioneer Street,Indio,Florida,104,Duis excepteur in eiusmod ea eiusmod voluptate pariatur tempor id aliqua minim. Irure nisi dolore culpa laboris veniam pariatur nostrud labore Lorem. Occaecat labore Lorem consectetur ullamco magna ad magna elit. Duis quis eu Lorem Lorem laborum minim laborum minim velit magna ex ipsum consequat consequat. Laboris do reprehenderit commodo aute adipisicing ut fugiat et nulla officia anim amet non. Ea consectetur sint qui cillum proident esse. Adipisicing dolor minim Lorem eiusmod.,2014-09-07T02:49:50 -06:-30,74.583133,19.905512,"ad,aute,reprehenderit,nostrud,commodo,minim,sit"
5aa252be461565d597db695c,72,26,brown,Tara Stokes,female,ZINCA,tarastokes@zinca.com,+1 (918) 556-3182,453,Madison Street,Crumpler,Vermont,102,Veniam laboris laboris cillum laboris in in. Officia veniam sit ut sunt veniam quis ipsum pariatur cupidatat. Eu amet nulla magna dolor ullamco ea adipisicing Lorem duis cupidatat. Incididunt magna incididunt enim irure voluptate quis. Laboris ex ullamco irure ipsum reprehenderit minim ipsum consectetur adipisicing ullamco labore sit laborum.,2016-03-12T09:08:07 -06:-30,8.212396,142.602116,"cillum,ad,non,officia,veniam,do,sit"
5aa252be4683e369a9aee56e,73,35,blue,Fleming Doyle,male,CIRCUM,flemingdoyle@circum.com,+1 (881) 498-3173,747,Fuller Place,Shasta,Alaska,103,Tempor adipisicing veniam est veniam eiusmod sunt enim amet aliquip. Magna deserunt deserunt elit fugiat magna in ex culpa incididunt pariatur aliqua. Id occaecat aliqua esse Lorem non et qui enim fugiat. Qui sint esse exercitation occaecat. Excepteur consequat veniam do dolore. Consectetur aliqua mollit laborum proident irure consectetur dolor elit laboris eu elit do tempor. Tempor consequat exercitation mollit esse adipisicing ut dolore voluptate est sit ad pariatur exercitation.,2016-07-30T12:24:33 -06:-30,-86.402598,146.261652,"commodo,voluptate,veniam,enim,laboris,exercitation,aliqua"
5aa252be32cf60e937feb7d9,74,32,blue,Meagan Kramer,female,PROGENEX,meagankramer@progenex.com,+1 (963) 433-2830,285,National Drive,Trona,Alabama,107,Non fugiat mollit deserunt pariatur anim. Dolore adipisicing aliquip reprehenderit laborum qui do. Id aliquip ut commodo sunt Lorem. Mollit duis sunt est magna laborum fugiat in nisi amet enim aliquip fugiat.,2017-12-11T11:37:39 -06:-30,67.362314,-33.35109,"cillum,id,voluptate,enim,exercitation,proident,sit"
5aa252be7f3adbc29a3282dc,75,26,green,Travis Freeman,male,KEENGEN,travisfreeman@keengen.com,+1 (812) 582-3719,380,Atlantic Avenue,Centerville,Minnesota,108,Exercitation eiusmod cillum aute culpa cillum aliquip minim anim eu. Labore irure irure nulla ipsum officia consequat minim minim consectetur officia sunt. Fugiat ad ipsum nostrud magna occaecat laborum non ullamco mollit aliqua officia consequat. Irure sunt ea sit dolor et Lorem adipisicing in. Cupidatat amet nulla reprehenderit minim ex cillum aute nostrud. Mollit culpa dolore do est id tempor. Do ea et voluptate deserunt elit ex tempor.,2014-04-19T01:28:11 -06:-30,0.421714,121.837804,"esse,aute,deserunt,qui,adipisicing,excepteur,quis"
5aa252be8d5cc069c85a1f05,76,36,green,Valenzuela Duran,male,COMTRAIL,valenzueladuran@comtrail.com,+1 (905) 565-2761,986,Kent Avenue,Woodruff,Colorado,109,Veniam velit mollit dolor officia quis amet nisi deserunt elit tempor. Culpa nulla incididunt qui eu aute excepteur sint esse dolore tempor quis sit sunt. Nulla consectetur cupidatat officia cupidatat. Nulla proident non dolore enim consequat non labore cupidatat ex sit est.,2015-11-25T09:04:04 -06:-30,52.694189,-21.98896,"magna,elit,Lorem,officia,nisi,ipsum,ipsum"
5aa252be9e56aecf18e1080f,77,37,green,Morin Walsh,male,VIASIA,morinwalsh@viasia.com,+1 (810) 547-3582,897,Ridgewood Avenue,Jardine,South Dakota,103,Amet voluptate nostrud magna fugiat culpa amet ullamco ullamco quis velit aliqua dolor irure cupidatat. Tempor quis cillum eu labore labore anim sunt non nisi eu in cupidatat. Velit ut laborum officia ut ea in consequat. Magna ullamco ut sunt consectetur occaecat incididunt. Nisi commodo pariatur proident eu in. Voluptate exercitation sunt laborum pariatur laborum exercitation incididunt labore amet pariatur sint adipisicing in consequat.,2016-05-11T01:58:52 -06:-30,24.789764,-112.483002,"cillum,sit,cillum,incididunt,enim,magna,do"
5aa252beb25d2f02df62d5d7,78,33,green,Owens Webb,male,RONELON,owenswebb@ronelon.com,+1 (803) 571-2065,955,Vandalia Avenue,Newkirk,Louisiana,107,Ut ad amet laboris sunt excepteur. Ea eiusmod magna nulla aute cupidatat deserunt esse Lorem veniam pariatur adipisicing. Pariatur consequat pariatur sunt cillum nisi pariatur consequat anim consectetur veniam anim. Esse excepteur mollit cupidatat ea. Esse laboris sunt est in reprehenderit pariatur quis. Veniam laborum aliqua labore dolor ex est consectetur occaecat excepteur in enim aliqua occaecat.,2014-04-04T12:40:23 -06:-30,-36.380368,-177.454981,"occaecat,nostrud,enim,qui,fugiat,minim,nisi"
5aa252be511b5a3093e1c23d,79,33,green,Booker Valenzuela,male,ACCUFARM,bookervalenzuela@accufarm.com,+1 (888) 576-2316,223,Commercial Street,Harold,Rhode Island,101,Veniam ea cupidatat veniam proident nulla tempor reprehenderit anim exercitation sit adipisicing ex amet. Id dolor irure velit mollit sit nostrud deserunt cupidatat. Dolore officia eiusmod dolor consectetur velit. Voluptate esse exercitation enim nulla do duis nostrud. Ea dolor non mollit nulla ea consectetur et eiusmod dolor officia sit nisi elit.,2015-09-02T01:29:57 -06:-30,-66.596721,60.445052,"labore,excepteur,deserunt,sit,magna,commodo,velit"
5aa252befe857c6083def5ee,80,31,brown,Taylor Harris,female,PORTALIS,taylorharris@portalis.com,+1 (861) 415-3349,365,Benson Avenue,Robinette,Illinois,104,Irure cupidatat excepteur quis labore cupidatat culpa mollit ea pariatur officia magna officia. Sunt id reprehenderit aliqua aliqua irure ullamco incididunt voluptate. Sint dolore enim consectetur officia culpa proident nisi sit magna irure sint velit do sit. Culpa minim velit deserunt non commodo magna ex nisi Lorem labore. Enim et non occaecat nostrud esse.,2017-07-29T08:55:50 -06:-30,-16.035324,87.432146,"nisi,dolor,id,aliquip,eu,ut,cillum"
5aa252be7d96501986a3b026,81,21,brown,Finch Gilbert,male,MULTIFLEX,finchgilbert@multiflex.com,+1 (928) 522-3813,798,Devoe Street,Winesburg,Kansas,105,Anim esse ex adipisicing laboris do proident exercitation ad proident. Deserunt ad labore ad id nisi nulla duis. Mollit et eiusmod eu incididunt. Laboris nisi eu fugiat dolore minim ipsum occaecat duis et aliqua consectetur esse laboris dolore. Sit id ullamco proident dolor Lorem ea duis cillum amet nisi nisi.,2016-08-30T04:03:27 -06:-30,-7.769427,34.23225,"do,incididunt,ea,reprehenderit,amet,tempor,adipisicing"
5aa252bebc8109e481e447ab,82,25,blue,Hodges Stanton,male,INSURON,hodgesstanton@insuron.com,+1 (805) 554-2954,156,Clinton Street,Sterling,Pennsylvania,110,Sit eu adipisicing anim velit nostrud cupidatat. Et deserunt esse quis aliqua non cillum laboris pariatur ipsum eu sit id laboris voluptate. Quis laboris consequat tempor dolore consectetur pariatur officia cupidatat est consequat est nostrud ad. Aliqua proident adipisicing eu elit eiusmod est irure aliqua duis laborum.,2015-07-25T01:52:34 -06:-30,-13.184333,127.249116,"duis,deserunt,cillum,est,voluptate,consectetur,enim"
5aa252bef546fd5deb2b8b88,83,27,brown,Christa Clay,female,PHEAST,christaclay@pheast.com,+1 (950) 481-2899,785,Gerritsen Avenue,Clarksburg,Federated States Of Micronesia,107,Ipsum non cillum velit ex ea ut. Magna Lorem laborum exercitation velit officia qui officia non fugiat excepteur. Veniam non nisi commodo duis. Magna amet veniam elit exercitation anim esse magna sunt dolore do mollit id. Veniam do sit cupidatat esse mollit reprehenderit adipisicing dolor et eiusmod elit. Veniam deserunt enim aliqua fugiat duis consequat in deserunt aute cillum.,2016-05-03T06:27:11 -06:-30,42.286907,-14.266722,"duis,elit,sint,in,non,veniam,reprehenderit"
5aa252bed66f660cb2cc0837,84,30,green,Jessie Oneal,female,QUARMONY,jessieoneal@quarmony.com,+1 (996) 540-3407,464,Rose Street,Ypsilanti,District Of Columbia,110,Consectetur quis ad id duis voluptate cillum minim. Sunt adipisicing aute cupidatat exercitation ut enim laborum veniam do occaecat minim ipsum. Reprehenderit voluptate enim irure quis aliqua nisi deserunt deserunt. Enim qui cillum dolor proident enim commodo commodo cillum culpa elit labore dolore. Adipisicing non dolore enim pariatur aliqua. Sunt cupidatat ex labore esse laborum fugiat commodo esse duis magna commodo proident. Irure eu et voluptate nostrud laborum dolore minim qui enim do occaecat veniam proident.,2014-01-02T07:44:03 -06:-30,-59.160798,-17.085982,"eiusmod,proident,duis,ipsum,sit,voluptate,esse"
5aa252be9b66f47d352e17c1,85,20,green,Josie Moon,female,GEEKOSIS,josiemoon@geekosis.com,+1 (827) 440-3356,780,Broome Street,Fulford,New York,110,Fugiat in officia aliqua ad aliqua eiusmod do veniam esse. Veniam dolor laboris exercitation Lorem proident ullamco tempor anim irure adipisicing occaecat laboris reprehenderit. Proident occaecat ad reprehenderit veniam consectetur. Mollit dolor anim fugiat sit cillum dolore in. Nulla minim eu proident in ea ipsum esse labore ad. Nulla ad veniam aute tempor fugiat velit sit laboris qui aliquip.,2016-02-26T03:22:28 -06:-30,87.81266,142.40541,"ut,quis,eu,velit,dolor,esse,sit"
5aa252beb7e1c20b69dcd90a,86,32,blue,Fox Murray,male,LOCAZONE,foxmurray@locazone.com,+1 (977) 588-3900,488,Ross Street,Terlingua,Maryland,109,Tempor duis incididunt in voluptate Lorem ad culpa excepteur ullamco minim officia minim fugiat dolor. Cillum cillum excepteur nulla eu reprehenderit aliqua ad occaecat enim laborum labore excepteur. Velit do occaecat mollit ea occaecat magna commodo. Eiusmod proident ut fugiat consequat occaecat eu. Sit nostrud non cupidatat consectetur dolor ullamco ex anim dolor et proident laboris consectetur in. Irure quis labore nulla cillum excepteur duis in dolor qui.,2014-08-13T11:22:16 -06:-30,-1.787937,-37.994283,"fugiat,ex,adipisicing,elit,ad,labore,aliquip"
