_id,index,age,eyeColor,name,gender,company,email,phone,number,street,city,state,zipcode,about,registered,latitude,longitude,tags
5aa252be4f826780ecdff4b3,87,24,blue,Hurley Justice,male,PODUNK,hurleyjustice@podunk.com,+1 (967) 480-2250,459,Vandervoort Avenue,Joes,West Virginia,103,Consectetur mollit minim labore voluptate laboris. Velit proident cillum sunt esse dolor nostrud laboris sit. Tempor do excepteur duis ullamco proident veniam enim. Sit elit cupidatat ea consequat reprehenderit mollit sit esse laboris sit velit.,2017-02-17T04:42:57 -06:-30,79.189869,-149.816647,"aliqua,sit,proident,do,reprehenderit,officia,elit"
5aa252be9869cb51a198b1cf,88,23,blue,Norman Richards,male,TEMORAK,normanrichards@temorak.com,+1 (936) 550-3116,229,Lawn Court,Lutsen,Arkansas,109,Culpa aliqua dolor ea non officia incididunt pariatur deserunt esse ut ex aliquip ullamco. Esse consequat anim minim deserunt aute nisi ex pariatur esse dolor. Elit nulla ea elit officia veniam aliqua reprehenderit id cillum qui. Ea est officia esse duis anim fugiat laborum esse in Lorem do mollit proident laboris. Esse mollit laboris consectetur dolore minim anim reprehenderit exercitation incididunt magna duis veniam.,2014-09-10T12:17:52 -06:-30,8.005736,-1.16211,"est,veniam,consequat,Lorem,Lorem,amet,dolore"
5aa252be3daa81b4e4637f18,89,27,blue,Hooper Brown,male,ECLIPSENT,hooperbrown@eclipsent.com,+1 (939) 561-2977,410,Dare Court,Cedarville,North Dakota,109,Veniam minim quis nisi commodo in aliquip dolor nostrud nisi adipisicing ipsum. Aliqua sunt eu dolor cupidatat eu minim cupidatat deserunt laborum eiusmod nulla. In adipisicing enim eiusmod reprehenderit officia. Officia in laboris enim fugiat adipisicing eu deserunt consequat nostrud quis labore. Tempor mollit nostrud nostrud dolore cillum ad nisi officia.,2016-01-13T05:05:07 -06:-30,40.679111,-102.378462,"exercitation,voluptate,occaecat,aliqua,voluptate,commodo,ad"
5aa252be4e37a7e0bf9f3727,90,32,blue,Boyd Murphy,male,ACRUEX,boydmurphy@acruex.com,+1 (909) 401-2254,252,Coleman Street,Wescosville,South Carolina,107,Culpa quis consequat duis mollit sit commodo esse sunt nulla labore anim nostrud laboris aliquip. Mollit ea amet sunt aliqua laborum fugiat laborum anim quis elit. Mollit exercitation mollit velit et laboris veniam velit occaecat. Velit esse ex culpa enim.,2014-01-23T06:27:28 -06:-30,61.437346,-11.785943,"pariatur,laboris,velit,magna,commodo,est,aliquip"
5aa252be2d48e11f0c3f65e9,91,20,brown,Campbell Everett,male,KONGLE,campbelleverett@kongle.com,+1 (986) 577-3333,361,Mermaid Avenue,Bridgetown,Oregon,108,Excepteur elit exercitation nulla officia ea dolor occaecat quis adipisicing esse do sit elit deserunt. Enim consequat ipsum duis in do cillum officia non esse nostrud esse tempor sit sit. Sunt duis id in nostrud. Mollit occaecat ea ad nulla proident consequat. Aliquip eiusmod deserunt velit elit aute pariatur officia.,2016-07-19T02:57:12 -06:-30,-19.362449,114.601938,"sit,anim,aute,adipisicing,ut,et,velit"
5aa252be175f8365afb606f7,92,31,green,Stewart Mcconnell,male,ARCTIQ,stewartmcconnell@arctiq.com,+1 (813) 461-3070,401,Dunne Place,Allamuchy,Michigan,102,Ullamco esse est laboris quis. Excepteur cillum cillum aliquip tempor pariatur enim enim aute. Velit esse minim qui quis sit.,2016-12-06T01:52:44 -06:-30,50.118147,41.296123,"officia,irure,irure,commodo,nostrud,anim,eu"
5aa252be14a17889c05b3ea2,93,37,brown,Nelda Winters,female,ZANITY,neldawinters@zanity.com,+1 (966) 577-2629,248,Wyckoff Street,Eagletown,Ohio,109,Reprehenderit nostrud sint consequat cillum esse mollit laborum labore. Labore dolore quis nostrud consequat enim irure. Incididunt laboris magna ipsum sit dolore elit ut duis ea. Aute reprehenderit esse laboris sit dolor laborum mollit. Nostrud laboris sunt deserunt dolor laboris eu. Occaecat voluptate cupidatat esse do officia ipsum aute cupidatat aute ullamco velit.,2016-01-24T04:38:43 -06:-30,-20.982769,-25.255738,"incididunt,aliquip,eiusmod,consectetur,adipisicing,sit,elit"
5aa252bedbbb6165f8ae25b0,94,28,green,Mona Durham,female,ROCKLOGIC,monadurham@rocklogic.com,+1 (984) 538-3742,361,Erskine Loop,Calpine,Wisconsin,105,Incididunt reprehenderit culpa qui magna laboris incididunt excepteur adipisicing est elit in adipisicing do quis. Id aute ullamco sit mollit ipsum proident laborum ipsum irure proident officia duis. Lorem adipisicing ut excepteur esse amet adipisicing ut proident. Exercitation veniam ad ullamco do incididunt enim commodo irure.,2016-12-04T07:26:40 -06:-30,41.605772,160.216074,"elit,enim,nostrud,nulla,aliqua,ea,nisi"
5aa252be5c4920cbc8981900,95,26,green,Liza Schroeder,female,RODEOMAD,lizaschroeder@rodeomad.com,+1 (813) 403-3735,233,Euclid Avenue,Bentley,Idaho,106,Nostrud laboris duis non nulla. Velit dolore excepteur quis enim laborum qui ullamco ipsum aute esse. Lorem adipisicing veniam aliquip veniam occaecat aute mollit est adipisicing ad. Nisi amet cillum nulla irure. Cupidatat ex do minim Lorem dolor sint.,2016-09-26T01:09:39 -06:-30,14.573978,-4.902851,"mollit,fugiat,labore,magna,ex,dolor,culpa"
5aa252beff7364c43679b0ea,96,40,brown,Judith Hicks,female,DIGIGENE,judithhicks@digigene.com,+1 (919) 494-2868,999,Middleton Street,Brandermill,Texas,100,Nisi deserunt sunt anim et occaecat consequat commodo ea id ea eu enim sit nulla. Irure sunt ullamco et dolor fugiat. Deserunt aute nostrud ad occaecat id anim non. Ullamco officia deserunt elit tempor eiusmod pariatur enim eu. Eu ullamco ad id aute. Quis aliqua aliquip deserunt consequat fugiat sint ex incididunt irure.,2018-01-24T10:19:24 -06:-30,-24.616115,33.386065,"culpa,nostrud,ipsum,elit,esse,labore,consectetur"
5aa252be314ad9595bed74d1,97,35,green,Estela Franco,female,ZANYMAX,estelafranco@zanymax.com,+1 (989) 578-2255,205,Wythe Avenue,Chautauqua,Indiana,108,Duis enim commodo pariatur cillum mollit eu mollit ex laborum. Dolore cupidatat nostrud nulla voluptate excepteur consectetur in id cupidatat deserunt nostrud. Ea amet anim nulla velit.,2017-10-17T05:31:54 -06:-30,89.533836,152.935574,"ex,sit,pariatur,cillum,enim,nulla,et"
5aa252be46ea8703df79cd5d,98,39,green,Slater Pierce,male,GLOBOIL,slaterpierce@globoil.com,+1 (954) 560-2951,419,Havemeyer Street,Venice,Hawaii,104,Qui deserunt veniam non laboris qui non elit non officia. Est pariatur consectetur nostrud non in sint in ullamco culpa aliquip sit culpa irure. Anim enim incididunt ipsum ullamco dolore adipisicing adipisicing anim in adipisicing aliqua. Ut in proident aliquip do veniam fugiat veniam ea velit et cillum elit dolor reprehenderit. Id do irure eiusmod minim eiusmod consectetur ex consequat cupidatat ut aliqua cupidatat. Cillum magna anim consequat id nisi velit laborum sunt id consequat quis. Duis ad laborum qui pariatur eu sit exercitation elit minim incididunt fugiat.,2014-08-24T01:53:39 -06:-30,70.791113,156.944903,"elit,esse,sit,ea,cillum,Lorem,non"
5aa252be6f8aabd2edb78b17,99,23,brown,Leola Gentry,female,VICON,leolagentry@vicon.com,+1 (871) 574-3573,685,Albany Avenue,Vowinckel,Utah,102,Esse qui amet quis voluptate do in. Nostrud eiusmod eiusmod sunt velit id est. Officia irure deserunt cupidatat magna adipisicing aliqua reprehenderit nostrud laborum cupidatat.,2014-11-28T01:19:51 -06:-30,50.198135,22.786374,"irure,cillum,elit,laboris,enim,qui,occaecat"
5aa252be30cf16c16b157242,100,33,brown,Lucile Page,female,SHEPARD,lucilepage@shepard.com,+1 (890) 482-3092,134,Bliss Terrace,Hartsville/Hartley,Marshall Islands,102,Lorem nulla veniam mollit laboris magna voluptate est nulla pariatur id. Dolore anim cillum eiusmod velit sit velit ullamco pariatur mollit officia. Aliquip tempor dolore officia id eiusmod commodo quis et occaecat fugiat sunt eiusmod deserunt. Eiusmod id aute cillum in dolor ea ipsum ipsum.,2017-11-20T02:45:28 -06:-30,-26.372874,-43.257161,"quis,sint,sunt,exercitation,ut,exercitation,aliquip"
5aa252be4fe8b439039fcc56,101,34,green,Christy Booker,female,ISOLOGIX,christybooker@isologix.com,+1 (924) 589-2762,475,Knickerbocker Avenue,Fivepointville,Montana,105,Veniam duis mollit veniam enim proident do magna id ipsum aute. Consequat culpa sunt ex adipisicing sit ullamco pariatur velit. Non elit aute irure laborum irure eu consequat commodo nostrud in reprehenderit eiusmod. Id adipisicing irure nostrud nulla veniam ullamco. Adipisicing eu proident ex sunt Lorem esse qui.,2017-04-03T04:09:13 -06:-30,25.943876,29.762478,"excepteur,aliqua,velit,laborum,est,non,consequat"
5aa252be396d442999d2cc27,102,29,green,Quinn Santana,male,VERTIDE,quinnsantana@vertide.com,+1 (954) 441-2957,930,Ludlam Place,Sisquoc,Missouri,100,Mollit id dolor irure commodo cupidatat non ullamco duis sit. Excepteur reprehenderit elit laboris ullamco consequat nisi. Sit occaecat exercitation commodo do officia. Est ex sunt incididunt adipisicing officia excepteur minim adipisicing cupidatat ut enim sunt reprehenderit. Quis cillum et velit ullamco elit in deserunt. Ut culpa duis nisi elit consequat.,2015-07-13T02:49:00 -06:-30,-20.737841,74.354399,"in,aliquip,amet,ut,laboris,ipsum,aute"
5aa252beb28038b848553a0c,103,26,green,Molly Baker,female,IMAGINART,mollybaker@imaginart.com,+1 (846) 587-3244,609,Noble Street,Wiscon,Oklahoma,107,Enim eiusmod magna consequat Lorem id amet excepteur id mollit nisi commodo. Non culpa dolor non proident officia veniam veniam. Exercitation occaecat fugiat in magna laboris quis occaecat in veniam Lorem nostrud proident id ad. Excepteur sint aliqua dolor velit est et laboris veniam ea ipsum aliquip consectetur est.,2017-04-04T03:05:40 -06:-30,25.365248,106.550681,"adipisicing,qui,ad,minim,minim,excepteur,nulla"
5aa252be0ef294f178eddc41,104,33,green,Marina Malone,female,HYDROCOM,marinamalone@hydrocom.com,+1 (945) 413-2471,403,Irvington Place,Fredericktown,Connecticut,108,Dolore magna amet laboris ea non et veniam sunt anim sit laborum voluptate. Consectetur duis dolor magna est. Laborum nisi pariatur exercitation elit.,2014-06-24T03:25:05 -06:-30,77.5476,-125.364679,"esse,culpa,consequat,ipsum,pariatur,anim,nostrud"
5aa252be67367f006b9489bc,105,25,blue,Jenifer Hughes,female,TERASCAPE,jeniferhughes@terascape.com,+1 (990) 533-2831,820,Kenmore Court,Bodega,Northern Mariana Islands,107,Ex elit in cupidatat non nisi Lorem reprehenderit incididunt pariatur officia consectetur reprehenderit dolore. Nulla laborum cillum et nisi mollit labore. Aliqua occaecat anim quis in ad. Aliqua non laboris exercitation nulla nostrud mollit velit cillum excepteur sint. Velit et minim consectetur magna laboris eu amet Lorem ullamco eu sunt.,2015-03-04T06:38:50 -06:-30,62.545415,150.854584,"ullamco,esse,enim,elit,ut,laboris,ipsum"
5aa252be178a3febd4e4df19,106,22,green,Matilda King,female,ASSISTIA,matildaking@assistia.com,+1 (930) 430-2160,373,Stuart Street,Lithium,Iowa,106,Deserunt aliqua consequat voluptate consectetur non. Exercitation pariatur duis occaecat ea consectetur consectetur quis voluptate in nulla consequat. Nostrud exercitation sunt adipisicing deserunt. Ut mollit duis pariatur ad. Laborum eiusmod nostrud nostrud enim consectetur non labore eu amet dolore cillum. Tempor ex amet proident labore ipsum eiusmod elit ea eu.,2014-05-01T05:58:04 -06:-30,-28.076983,166.273323,"eu,incididunt,ea,deserunt,ea,elit,tempor"
5aa252be01b5ff30f6b4646e,107,40,green,Peck Stone,male,MELBACOR,peckstone@melbacor.com,+1 (918) 438-3172,750,Rutland Road,Cucumber,Mississippi,104,Et aliquip sunt qui adipisicing proident ullamco ea esse dolor cupidatat quis ut culpa occaecat. Minim ipsum pariatur nulla do duis id labore excepteur dolore ut aute magna aute id. Aliquip exercitation sint consectetur voluptate anim eiusmod minim consequat adipisicing.,2017-04-17T11:49:32 -06:-30,-25.291286,-9.377943,"eu,do,et,anim,commodo,nisi,cillum"
5aa252be632a2b30bd90fdc2,108,30,blue,Virgie Cervantes,female,KATAKANA,virgiecervantes@katakana.com,+1 (866) 480-2191,998,Bridgewater Street,Tonopah,Virgin Islands,107,Lorem ullamco exercitation aliqua non ea eu officia Lorem magna quis magna. Qui cupidatat velit nulla cupidatat ullamco consequat commodo nostrud. Tempor Lorem ad reprehenderit mollit Lorem consectetur ad duis est magna. Qui pariatur mollit reprehenderit exercitation consectetur voluptate. Do reprehenderit enim sunt ex laborum amet labore fugiat.,2014-07-14T06:30:05 -06:-30,-81.194624,123.656964,"nostrud,incididunt,esse,ut,consequat,magna,sunt"
5aa252be76601e369b15f06e,109,21,blue,Dolores Shaffer,female,CORIANDER,doloresshaffer@coriander.com,+1 (840) 528-2817,427,Raleigh Place,Clarence,Guam,105,Deserunt veniam eiusmod magna consectetur adipisicing mollit enim et ea irure. Cupidatat et commodo magna sit dolor duis eu sit commodo ipsum. Laboris qui ut cillum incididunt id amet tempor dolor qui officia officia deserunt esse. Velit velit elit proident amet enim ea ullamco nisi sit commodo quis esse non nulla. Excepteur cupidatat duis tempor consectetur adipisicing quis in ut velit cillum reprehenderit. Commodo et magna ullamco voluptate.,2016-04-24T09:34:38 -06:-30,70.926674,48.905261,"et,nostrud,ex,commodo,incididunt,nulla,eu"
5aa252be5463c3f2820ce726,110,22,blue,Blanche Vaughn,female,MUSIX,blanchevaughn@musix.com,+1 (895) 438-3258,803,Grove Place,Bloomington,Kentucky,110,Aute aliqua veniam officia sint excepteur fugiat ea. Enim cupidatat fugiat exercitation ut pariatur enim dolore. Dolore fugiat eiusmod aliquip id sunt minim dolor qui ullamco ad anim. Amet aliqua aliqua minim Lorem anim culpa fugiat deserunt sit tempor id non amet consequat. Laborum magna quis minim ea cillum enim consectetur mollit irure enim.,2017-06-28T12:17:34 -06:-30,-54.190002,30.02165,"qui,proident,excepteur,reprehenderit,nisi,proident,aliqua"
5aa252be01d77aa8610479a0,111,40,brown,Rosanne Gilliam,female,RECRISYS,rosannegilliam@recrisys.com,+1 (816) 443-2837,795,Lake Avenue,Celeryville,New Hampshire,109,Mollit minim exercitation dolore eu. In qui culpa sunt pariatur ullamco ullamco irure. Enim pariatur pariatur aliqua magna officia in dolore eu ullamco ullamco exercitation. Magna voluptate ad et pariatur eiusmod id eu cillum anim sit voluptate nulla esse proident. Aute sit et excepteur fugiat consequat elit duis aliqua officia quis tempor duis. Elit mollit et consectetur dolore sunt nisi reprehenderit enim irure sunt veniam velit enim. Veniam sit ut minim tempor nostrud et fugiat aliquip nisi excepteur.,2017-06-03T09:34:30 -06:-30,-43.379783,-5.53591,"id,dolore,elit,pariatur,anim,tempor,culpa"
5aa252be7ee29caf7206913d,112,39,green,Ingram Guy,male,TWIGGERY,ingramguy@twiggery.com,+1 (992) 434-3218,564,Creamer Street,Summerset,North Carolina,106,Officia sunt ad dolore in amet cupidatat magna culpa aliquip. Duis irure incididunt ad non ea commodo minim in quis deserunt do sint aute ex. Nisi excepteur veniam eiusmod exercitation consectetur mollit. Cillum consectetur sit id veniam consequat anim qui amet veniam nostrud. In reprehenderit proident proident non. Incididunt consequat quis non magna irure anim officia aliqua fugiat dolore laborum ad consequat enim. Eiusmod non sint aliquip ex magna anim mollit.,2016-05-09T09:43:34 -06:-30,-15.732474,54.081267,"id,eiusmod,aute,et,ex,magna,incididunt"
5aa252beba88ebf8dd2474ca,113,29,brown,Dillon Velez,male,MACRONAUT,dillonvelez@macronaut.com,+1 (938) 547-2988,958,Mill Street,Needmore,Virginia,106,Mollit ex proident in laborum aliquip voluptate ipsum magna cupidatat. Exercitation ullamco esse nisi amet pariatur esse adipisicing laboris sunt. Consectetur do ipsum dolore adipisicing exercitation veniam ea in qui ut.,2016-10-03T08:55:00 -06:-30,-27.964591,-14.006033,"tempor,laboris,labore,officia,cupidatat,dolore,fugiat"
5aa252be072b0bef14127450,114,22,blue,Watts Dalton,male,SLAMBDA,wattsdalton@slambda.com,+1 (834) 547-3893,540,Royce Place,Grahamtown,Nevada,100,Velit irure do cupidatat dolore ut voluptate deserunt occaecat labore incididunt proident enim. Commodo ad eiusmod aliqua officia minim nisi nulla occaecat magna laboris tempor dolore amet enim. Irure elit irure qui eu commodo culpa magna occaecat cupidatat ex. Mollit sint exercitation duis in excepteur ad Lorem enim elit. Qui minim nulla id quis.,2014-10-28T03:31:44 -06:-30,-85.49165,129.815399,"qui,proident,esse,Lorem,anim,nostrud,quis"
5aa252be545b2cca5ce3dcaf,115,23,green,Tabitha Barker,female,ZILLACON,tabithabarker@zillacon.com,+1 (932) 584-2795,720,Arkansas Drive,Ballico,Massachusetts,105,Est culpa consectetur enim duis. Incididunt nostrud non ut anim consequat duis. Sunt enim ea exercitation tempor mollit ut sit. Proident aute nisi eu ex laborum eiusmod in amet officia proident aliqua duis velit velit.,2017-09-07T07:45:05 -06:-30,-72.048211,-124.050755,"amet,incididunt,irure,et,incididunt,nostrud,ex"
5aa252beee7b69e57002a5c0,116,40,green,Celia Peck,female,ZILLAN,celiapeck@zillan.com,+1 (903) 534-2206,266,Denton Place,Deercroft,Georgia,109,In pariatur cillum dolore sunt excepteur est eiusmod duis. Est et esse laboris consequat duis nisi aliquip. Pariatur et ullamco deserunt culpa aliqua sint voluptate dolore. Minim ut quis do ullamco ea ipsum. Sit ullamco do velit nulla quis nulla deserunt commodo id. Amet mollit excepteur anim labore nostrud ullamco est voluptate sit esse elit culpa. Officia Lorem incididunt velit non exercitation deserunt sit adipisicing ullamco culpa dolor est nisi esse.,2016-09-26T04:29:51 -06:-30,72.071892,-62.960154,"ullamco,fugiat,in,aute,aliquip,ut,et"
5aa252be662dddfd4953b2c3,117,23,brown,Patrica Russell,female,REALYSIS,patricarussell@realysis.com,+1 (853) 419-2179,253,Orange Street,Vale,New Jersey,108,Adipisicing sunt laborum ullamco voluptate amet pariatur occaecat id ipsum mollit in exercitation. Proident et mollit consectetur mollit culpa sunt nisi in. Ipsum velit in fugiat deserunt. Velit elit aliquip commodo proident consequat reprehenderit. Commodo ut cupidatat labore cillum duis officia et amet. Id magna commodo tempor qui voluptate qui reprehenderit.,2014-10-12T04:53:51 -06:-30,-77.663221,169.882387,"enim,do,ut,ullamco,esse,velit,nisi"
5aa252be212bcc1e8c0d959d,118,39,blue,Foreman Wade,male,DIGIRANG,foremanwade@digirang.com,+1 (921) 542-2139,918,Putnam Avenue,Davenport,American Samoa,102,Ad duis labore eu excepteur officia consequat deserunt incididunt velit cillum ex elit. Ad sint consequat laboris id aute enim velit amet ullamco sit magna est. Est enim do do labore nostrud enim aliquip culpa excepteur adipisicing ad amet consequat. Anim fugiat sunt voluptate id. Proident ullamco sit nulla aute.,2014-11-19T10:27:10 -06:-30,75.10996,-72.645226,"qui,sit,enim,nulla,veniam,duis,exercitation"
5aa252be68733bb0e474c7e9,119,33,green,Noemi Lynch,female,ZBOO,noemilynch@zboo.com,+1 (987) 593-2745,602,Wallabout Street,Nile,California,110,Excepteur esse ut est fugiat proident incididunt. Non eu magna dolore esse exercitation aliqua sunt irure deserunt aute dolor sint excepteur velit. Culpa eiusmod exercitation ullamco voluptate laboris tempor in tempor.,2016-02-06T11:17:10 -06:-30,-86.829017,-159.964397,"tempor,est,fugiat,enim,duis,occaecat,velit"
5aa252beb00a9915bf9c869d,120,31,green,Boyer Ryan,male,ENERSOL,boyerryan@enersol.com,+1 (988) 498-2991,428,Grafton Street,Tecolotito,New Mexico,107,Labore sit et ut eu velit fugiat duis labore non nisi. Mollit amet commodo laboris officia duis est Lorem voluptate ut consequat excepteur. Sint deserunt veniam consectetur ut ea ut nisi.,2016-06-14T11:42:40 -06:-30,-73.855371,109.135068,"veniam,pariatur,consectetur,occaecat,anim,ipsum,quis"
