_id,index,age,eyeColor,name,gender,company,email,phone,number,street,city,state,zipcode,about,registered,latitude,longitude,tags
5aa252be5d1e07697b16d463,0,38,green,Cain Goodman,male,SPORTAN,caingoodman@sportan.com,+1 (993) 518-3772,213,Clifford Place,Gerton,Georgia,102,Cillum elit officia minim amet. Incididunt nulla tempor ad dolore. Anim anim reprehenderit mollit occaecat irure laborum aute sint aute aliqua incididunt ad cillum id. Eu irure nulla sit officia eiusmod et anim consectetur exercitation velit.,2014-10-09T12:50:52 -06:-30,39.783865,-32.813122,"fugiat,nulla,adipisicing,nulla,do,officia,consectetur"
5aa252be7d1af2c3f398d8ff,1,27,blue,Church Massey,male,PERMADYNE,churchmassey@permadyne.com,+1 (828) 527-2740,759,Norfolk Street,Balm,New Jersey,106,Est duis officia irure fugiat aliqua pariatur cillum deserunt officia. Labore id esse magna culpa anim veniam nostrud. Consequat ad nisi ex Lorem pariatur id exercitation.,2015-07-01T02:46:50 -06:-30,7.305325,132.682285,"commodo,aliqua,aliqua,commodo,sunt,sit,pariatur"
5aa252beeb3c8eb482f3eb6f,2,23,brown,Jefferson Hopper,male,INCUBUS,jeffersonhopper@incubus.com,+1 (963) 596-2137,466,Cheever Place,Blende,American Samoa,108,Enim excepteur eu labore ea ipsum exercitation nostrud nulla ea. Sint minim voluptate nulla occaecat. Consequat reprehenderit incididunt do anim. Esse id voluptate nulla duis occaecat. Proident aute culpa nostrud velit minim adipisicing est ea consectetur deserunt laboris labore. Occaecat quis reprehenderit ex nulla dolore officia occaecat. Dolor laborum elit proident eiusmod tempor id ad veniam aliqua dolor non.,2014-07-31T04:19:31 -06:-30,-81.550949,160.820515,"id,incididunt,qui,pariatur,ad,do,commodo"
5aa252be18a3cc3699e78c80,3,33,green,Raquel Sexton,female,TECHADE,raquelsexton@techade.com,+1 (901) 532-2510,998,Kingsway Place,Jessie,California,109,Incididunt commodo incididunt ex ad duis cillum eu proident labore qui. Nulla deserunt laboris ad consequat veniam do ea. Minim adipisicing cupidatat ea ullamco aliquip tempor irure laborum ex. Culpa labore veniam velit reprehenderit aliquip proident voluptate.,2014-07-21T04:45:07 -06:-30,-64.179641,160.452117,"excepteur,veniam,deserunt,eiusmod,ipsum,Lorem,dolore"
5aa252be1408467b448e1739,4,33,green,Aline Ferrell,female,CORMORAN,alineferrell@cormoran.com,+1 (868) 418-3939,175,Losee Terrace,Welch,New Mexico,101,Exercitation sit elit veniam ex laboris ad Lorem in incididunt. Occaecat aliquip occaecat dolor ex nulla velit ullamco deserunt. Elit fugiat est sint enim Lorem amet ullamco labore veniam ut enim nostrud.,2016-08-06T07:54:57 -06:-30,9.299124,-84.312101,"consectetur,excepteur,aute,ipsum,et,eu,laborum"
5aa252bebb6457e768b6751a,5,38,brown,Middleton Vasquez,male,DIGIAL,middletonvasquez@digial.com,+1 (903) 551-2973,684,Troy Avenue,Leola,Wyoming,100,Esse est excepteur in cillum quis pariatur aliqua exercitation. Cupidatat duis officia tempor ullamco culpa eiusmod commodo non ullamco magna. Est adipisicing sint amet dolor elit ipsum voluptate. Culpa laborum fugiat in adipisicing ullamco.,2015-08-06T08:46:13 -06:-30,-54.509156,21.267975,"sint,anim,nulla,ex,ipsum,magna,aute"
5aa252be641e5ec0facde417,6,37,blue,Sweeney Sellers,male,COMFIRM,sweeneysellers@comfirm.com,+1 (863) 401-2973,291,Hendrickson Street,Magnolia,Washington,105,Duis id do nostrud occaecat veniam ipsum minim id. Laborum nulla cillum nostrud sint proident ad laboris excepteur. Irure aliquip aliqua sunt consectetur dolore deserunt nulla magna magna esse magna dolore nisi sunt. Sunt qui consequat dolor pariatur consectetur pariatur nulla. Sunt non consectetur occaecat id qui. Labore veniam dolore sunt esse sunt mollit esse nulla mollit ex ad. Voluptate ex nostrud elit pariatur qui.,2016-02-21T03:03:50 -06:-30,74.913063,-104.732762,"adipisicing,aliqua,nostrud,sunt,consequat,velit,ipsum"
5aa252be12eeaf6e32b3c967,7,35,blue,Juliet Gaines,female,MOMENTIA,julietgaines@momentia.com,+1 (980) 563-2438,146,Suydam Place,Bakersville,Delaware,104,Commodo do laborum elit ex. Cupidatat aliqua mollit amet nostrud veniam minim reprehenderit laborum est exercitation. Non in occaecat incididunt Lorem eu aliqua cillum commodo consectetur reprehenderit proident Lorem laboris. Nulla commodo ea dolore esse id anim minim commodo id laboris commodo veniam. Occaecat officia laborum eiusmod minim anim quis amet ut quis id fugiat. Ipsum ullamco aute labore est proident mollit anim duis ea minim Lorem proident ea amet. Incididunt ipsum exercitation anim adipisicing.,2015-05-12T01:27:26 -06:-30,-17.257529,-142.577311,"id,enim,deserunt,Lorem,Lorem,labore,labore"
5aa252be2b56e2711ab62d87,8,22,blue,Olive Wilkerson,female,KLUGGER,olivewilkerson@klugger.com,+1 (923) 459-2383,610,Aberdeen Street,Sanders,Nebraska,104,Consectetur sint incididunt consectetur consectetur anim commodo ea cupidatat exercitation pariatur ipsum dolor nisi. Pariatur sunt tempor aliquip commodo nulla. Tempor proident reprehenderit non consectetur deserunt qui quis et. Duis et esse irure pariatur amet minim tempor aute exercitation consectetur mollit.,2015-06-27T06:30:18 -06:-30,80.585698,72.543363,"incididunt,minim,ea,proident,in,amet,enim"
5aa252be5765447d73b3a41e,9,27,brown,Frazier Nelson,male,EXOSTREAM,fraziernelson@exostream.com,+1 (878) 469-2721,764,Dekoven Court,Bowden,Maine,109,Exercitation non nulla mollit et excepteur nulla amet cupidatat officia dolore laborum sint in veniam. Labore reprehenderit Lorem reprehenderit nisi sunt tempor. Cillum ea cupidatat voluptate labore ipsum ex laborum. Sunt consectetur culpa ipsum et qui. Velit consectetur dolore exercitation exercitation incididunt deserunt enim incididunt in. Laborum nulla incididunt tempor qui in aliqua eu aliqua eiusmod sunt.,2015-03-02T11:18:46 -06:-30,-16.572619,142.720547,"do,dolore,aliquip,esse,velit,amet,duis"
5aa252be8def90729e867e15,10,34,blue,Zelma Payne,female,BALOOBA,zelmapayne@balooba.com,+1 (936) 538-2871,701,Baughman Place,Weogufka,Palau,103,Elit fugiat in sit ipsum non consectetur. Cillum labore occaecat et dolore minim. Deserunt ullamco officia ullamco minim exercitation nulla tempor do cupidatat dolore fugiat labore Lorem ut. Amet consectetur aliqua id culpa fugiat tempor ipsum minim incididunt labore.,2014-06-10T02:11:56 -06:-30,-3.577423,-47.346311,"tempor,ex,aute,commodo,cupidatat,irure,sint"
5aa252be4b931f58ddb53cf4,11,29,green,Roberts Hester,male,NORALI,robertshester@norali.com,+1 (963) 520-3592,376,Bay Avenue,Conestoga,Tennessee,106,Elit sit amet ea proident irure ipsum sit tempor adipisicing aute ut enim. Magna veniam consectetur fugiat in aliquip et et deserunt laboris ipsum irure consectetur consequat. Aute sint aliquip laboris non non ea dolor nulla id occaecat fugiat Lorem elit. Sunt anim adipisicing irure eiusmod aute officia esse minim quis nulla qui culpa. Voluptate nostrud nostrud deserunt dolor enim Lorem anim consectetur consequat sunt. Qui mollit deserunt amet proident voluptate excepteur nulla in minim enim pariatur reprehenderit.,2014-09-24T01:16:03 -06:-30,-74.235665,-7.852159,"irure,consequat,fugiat,reprehenderit,aute,anim,dolore"
5aa252be25ee937e4c9f7a3f,12,28,blue,Haley Rosario,male,TALKOLA,haleyrosario@talkola.com,+1 (964) 591-3675,832,Moore Place,Coral,Arizona,110,Amet elit aute ipsum Lorem aute ipsum irure eu deserunt ad et esse exercitation quis. Esse occaecat pariatur eu ea qui excepteur deserunt id consequat nulla anim quis sint qui. Ullamco laboris magna eu ullamco magna cupidatat ex. Ad ad nostrud velit mollit esse in labore mollit dolore voluptate enim.,2014-02-16T04:34:57 -06:-30,-67.025967,89.476995,"minim,minim,excepteur,in,consequat,occaecat,amet"
5aa252be257ebd73333ba9a9,13,32,blue,Amalia Hutchinson,female,ENERSAVE,amaliahutchinson@enersave.com,+1 (803) 442-2287,639,Louisiana Avenue,Harviell,Florida,110,Enim deserunt irure officia irure. Eiusmod do ex proident ipsum duis consectetur Lorem ut incididunt labore ea cupidatat ad. Sint et dolore esse elit consequat tempor velit adipisicing ut tempor consectetur. Dolore pariatur nisi sit id enim aliqua anim dolore id dolore eiusmod. Sit velit eu amet Lorem cillum Lorem exercitation et sit consectetur aute aliqua exercitation est.,2016-01-17T02:01:08 -06:-30,80.022304,-173.321878,"ea,eu,ex,excepteur,ad,deserunt,quis"
5aa252bed0fd498c0b46a594,14,37,brown,Mindy Cash,female,FRENEX,mindycash@frenex.com,+1 (908) 473-3513,603,Woodhull Street,Newcastle,Vermont,107,Voluptate nostrud ea ullamco sunt do id velit eiusmod laboris cillum aute minim aliqua ad. Ut non non id amet esse velit ea dolor consectetur. Enim id incididunt adipisicing deserunt.,2014-05-01T10:31:53 -06:-30,-60.712971,175.605802,"ad,labore,reprehenderit,commodo,id,consequat,excepteur"
5aa252be7ec022f41c823f01,15,38,green,Rene Fitzpatrick,female,GONKLE,renefitzpatrick@gonkle.com,+1 (967) 543-2161,246,Brigham Street,Inkerman,Alaska,102,Voluptate anim sit labore cupidatat. Reprehenderit eiusmod eu ex incididunt cupidatat culpa duis nulla. Eu ea eu tempor esse adipisicing Lorem fugiat consectetur.,2015-10-24T01:20:42 -06:-30,59.765979,-85.169701,"id,commodo,nisi,veniam,occaecat,exercitation,elit"
5aa252be869c37d40817ddbd,16,31,blue,Blair Waller,male,MANTRIX,blairwaller@mantrix.com,+1 (846) 599-3097,247,Haring Street,Grenelefe,Alabama,108,Magna fugiat anim officia proident adipisicing aliquip ut laboris elit ad do in eiusmod. Nisi in Lorem eiusmod qui enim consequat aliqua. Dolor Lorem velit esse ipsum labore elit commodo ea cupidatat mollit aliqua pariatur anim. Laborum irure aliqua enim ipsum eu minim duis.,2017-01-17T09:16:40 -06:-30,-88.073005,-64.321991,"tempor,officia,do,eu,ut,exercitation,sint"
5aa252befa9656dac14fa09e,17,38,green,Kristin Glenn,female,CONCILITY,kristinglenn@concility.com,+1 (937) 516-2730,954,Woodside Avenue,Marienthal,Minnesota,105,Magna do reprehenderit cillum est excepteur laboris culpa qui Lorem eiusmod nisi deserunt irure. Ipsum exercitation sit anim ad nisi incididunt commodo fugiat aliqua excepteur commodo. Est pariatur adipisicing excepteur cillum. Et pariatur eu excepteur culpa voluptate anim nisi esse ipsum adipisicing. Magna et magna eu aute ea quis cillum non culpa reprehenderit culpa. Incididunt tempor irure do consectetur occaecat voluptate nisi.,2016-12-11T05:16:33 -06:-30,-66.451598,-52.444232,"esse,officia,duis,laboris,in,id,enim"
5aa252be52944229bedfd1ee,18,33,blue,Potter Mcclain,male,XIXAN,pottermcclain@xixan.com,+1 (929) 501-3700,721,Linden Street,Dana,Colorado,102,Ullamco cupidatat dolore anim commodo aliquip ad. Sunt proident nisi proident et irure minim est tempor nisi. Sint ex officia eu qui id deserunt id. Nisi amet nostrud velit aliqua ut adipisicing cupidatat duis occaecat eiusmod aute. Magna eiusmod in nostrud dolor amet eiusmod irure.,2014-02-22T09:54:40 -06:-30,-9.68108,103.163837,"aliquip,labore,in,dolor,sunt,sunt,ut"
5aa252be7101728d3f30dcee,19,39,green,Kline Nichols,male,MINGA,klinenichols@minga.com,+1 (838) 458-2465,892,Doone Court,Kenwood,South Dakota,107,Labore fugiat magna deserunt deserunt esse occaecat labore reprehenderit dolor dolor. Magna eiusmod dolore exercitation do sunt ad. Dolore aliquip proident culpa nisi in aliqua enim nostrud nisi ullamco voluptate nostrud magna ex. Incididunt consequat dolor velit commodo sint anim nisi consectetur sit cillum mollit anim.,2015-05-01T05:44:24 -06:-30,9.548649,-60.636845,"fugiat,deserunt,in,voluptate,nulla,laboris,elit"
5aa252be2433125841d965f8,20,31,brown,Penelope Daniel,female,ULTRIMAX,penelopedaniel@ultrimax.com,+1 (825) 439-3947,804,Congress Street,Diaperville,Louisiana,108,Ex tempor excepteur sint eu aliquip pariatur ex ipsum consectetur adipisicing est tempor fugiat id. Officia quis ea consectetur anim magna et eiusmod dolore voluptate. Cillum exercitation sit proident eiusmod aliquip culpa deserunt deserunt minim reprehenderit cupidatat.,2014-05-10T02:55:49 -06:-30,-0.158806,-164.69573,"aliqua,culpa,officia,deserunt,cillum,irure,fugiat"
5aa252bea78157aa9a65766d,21,33,blue,Bowen Moran,male,STEELFAB,bowenmoran@steelfab.com,+1 (922) 476-3457,743,Florence Avenue,Advance,Rhode Island,100,Ut excepteur minim quis irure. Consequat ad id proident commodo ullamco consectetur eiusmod adipisicing elit. Amet mollit ad laboris aliqua. Qui elit id cillum deserunt duis laboris irure pariatur nulla elit cillum qui in tempor. Mollit quis aute voluptate ut. Labore et magna et laboris consectetur.,2017-01-07T10:19:57 -06:-30,-61.207918,-112.922234,"eu,incididunt,laborum,ea,elit,consectetur,irure"
5aa252be6d9001d6b30515b8,22,23,brown,Kim Ayala,female,POLARIA,kimayala@polaria.com,+1 (837) 489-2301,885,Throop Avenue,Kerby,Illinois,102,Laboris fugiat non irure proident ad est sunt deserunt ut minim veniam adipisicing commodo fugiat. Pariatur adipisicing ad ad non sunt labore laboris sunt. Laborum ad dolor minim eu minim Lorem Lorem laborum. Velit laboris anim consectetur sit Lorem magna ad ad ut anim.,2017-01-28T03:16:44 -06:-30,36.451316,-5.929977,"duis,pariatur,tempor,ex,enim,nisi,adipisicing"
5aa252be6f343ec5a832a80d,23,35,green,Richard Lindsey,male,LYRIA,richardlindsey@lyria.com,+1 (898) 581-2375,945,Pooles Lane,Babb,Kansas,109,Lorem cupidatat duis excepteur ullamco enim velit quis excepteur officia qui velit officia sint. Aliqua ut nostrud commodo dolore dolore mollit pariatur ex eiusmod consequat ullamco officia est consectetur. Elit magna incididunt aliquip consectetur consectetur ut mollit nulla id sint ullamco ullamco. Mollit cillum magna labore ullamco occaecat sint labore velit voluptate pariatur anim fugiat. Ullamco nulla incididunt velit minim excepteur ad voluptate officia eu est. Eiusmod quis amet adipisicing in cillum elit sit duis eu eiusmod. Dolor ex non deserunt deserunt eiusmod consequat enim ex incididunt anim.,2016-11-10T07:09:52 -06:-30,-63.221241,105.074699,"ex,commodo,ad,in,consectetur,ea,cupidatat"
5aa252be6ac239ceafe89c8e,24,32,brown,Lizzie Rivas,female,HELIXO,lizzierivas@helixo.com,+1 (987) 413-2460,611,Norman Avenue,Comptche,Pennsylvania,104,Est mollit non aliqua Lorem labore ipsum cupidatat ut eu sunt exercitation Lorem et anim. Lorem nisi non et consequat. Pariatur velit labore non non. Cillum ea et ut anim sunt laborum officia qui labore aliquip do deserunt do. Est ad occaecat pariatur minim ut do eiusmod dolore eu culpa. Fugiat minim sit culpa consectetur eu ad incididunt. Commodo exercitation amet nulla consectetur deserunt deserunt consectetur ad et do eiusmod cillum elit.,2015-05-17T01:57:20 -06:-30,43.472488,-48.039263,"quis,labore,adipisicing,duis,laboris,ut,ullamco"
5aa252be0972569cd48200ac,25,27,brown,Booth Stewart,male,MYOPIUM,boothstewart@myopium.com,+1 (860) 415-2363,577,Driggs Avenue,Graball,Federated States Of Micronesia,108,Esse magna aliqua mollit deserunt. Non amet velit occaecat exercitation nostrud mollit exercitation sunt. Incididunt veniam velit proident sint non cupidatat dolore deserunt nisi est tempor incididunt in.,2014-07-09T07:42:09 -06:-30,24.787038,-119.044918,"nulla,ad,et,veniam,officia,aute,cupidatat"
5aa252bef71e1a9ea4df885e,26,29,green,Lucia Battle,female,APEX,luciabattle@apex.com,+1 (944) 563-3736,809,Harden Street,Wawona,District Of Columbia,108,Ut id tempor commodo duis proident irure. Lorem nisi esse duis duis exercitation. Sunt labore irure magna deserunt exercitation ut fugiat veniam ipsum Lorem voluptate. Voluptate adipisicing nulla incididunt sunt adipisicing eu incididunt laborum. Aliquip enim nostrud magna culpa esse dolor irure culpa velit non laboris est ipsum.,2015-09-15T02:55:36 -06:-30,17.559805,21.893279,"ex,enim,quis,consequat,amet,ea,exercitation"
5aa252bed5b788526f5fb77e,27,21,blue,Briggs Bender,male,OPTIQUE,briggsbender@optique.com,+1 (856) 408-3090,652,Neptune Court,Steinhatchee,New York,100,Exercitation magna mollit ad nisi ad commodo eu sint. Labore voluptate incididunt irure voluptate consequat ullamco exercitation eiusmod ipsum ea ipsum. Deserunt sint eu proident sunt ipsum ipsum ut et. Eu non anim esse aute consectetur. Lorem excepteur labore consequat incididunt eu enim elit duis nisi culpa proident. Officia et enim ad ipsum sit ad. Consequat enim culpa anim Lorem ullamco qui amet nisi sit mollit incididunt do nisi enim.,2017-11-30T09:46:40 -06:-30,-21.684925,85.151467,"consequat,tempor,reprehenderit,qui,mollit,quis,sint"
5aa252be761210fe9acd40c6,28,22,blue,Koch Brewer,male,PRINTSPAN,kochbrewer@printspan.com,+1 (985) 401-3202,577,Grant Avenue,Wanship,Maryland,104,Sit duis occaecat nisi ad enim velit eu. Fugiat dolore nisi eiusmod et occaecat voluptate laboris culpa ex consequat quis et. Eu nisi tempor ullamco sunt officia aliqua id nulla consequat. Lorem ipsum ut proident velit ut minim tempor. Et ullamco dolor commodo non cupidatat nulla magna.,2015-04-13T02:49:54 -06:-30,15.504712,142.055911,"enim,cillum,cillum,magna,ut,anim,aliquip"
5aa252be8b672c22234eed5f,29,28,brown,Miriam Underwood,female,PURIA,miriamunderwood@puria.com,+1 (925) 528-3552,551,Fountain Avenue,Bancroft,West Virginia,106,Ea non aliqua Lorem Lorem labore excepteur. Minim reprehenderit occaecat pariatur ex in ullamco. Consectetur voluptate esse culpa cupidatat qui tempor deserunt. Consectetur deserunt fugiat enim duis incididunt irure dolore nisi cillum. Ea sit consectetur ullamco quis fugiat nostrud occaecat tempor fugiat elit laborum minim.,2018-02-22T05:19:09 -06:-30,23.959758,-3.944915,"excepteur,ullamco,qui,aliquip,est,voluptate,eiusmod"
5aa252bea97afe7956cc4bd7,30,24,brown,Queen Cote,female,XEREX,queencote@xerex.com,+1 (895) 525-3312,101,Wilson Street,Roulette,Arkansas,107,Duis dolore duis velit et. Ut veniam magna enim tempor est officia veniam reprehenderit adipisicing. Enim cupidatat nostrud anim do anim consequat irure est officia aliqua. Non exercitation aliquip minim consequat cillum. Amet fugiat in id irure deserunt ea ut anim.,2015-03-22T08:46:38 -06:-30,-36.835057,-84.618364,"tempor,in,dolore,aliquip,aliqua,elit,sunt"
5aa252be01865d3202ddcbac,31,30,green,Santana Hogan,male,TROLLERY,santanahogan@trollery.com,+1 (854) 407-3949,802,Maple Avenue,Colton,North Dakota,105,Est incididunt pariatur ex ea in nostrud est consequat sit esse Lorem ad est reprehenderit. Voluptate veniam minim tempor Lorem occaecat amet amet id adipisicing excepteur dolor duis sint dolore. Eiusmod duis veniam commodo tempor labore duis ipsum aliquip nulla ut. Adipisicing laboris pariatur sunt et ex proident. Sunt excepteur cillum aute laborum id duis irure do excepteur amet in aliqua aute ad. Laborum qui laborum ipsum reprehenderit proident culpa commodo non ea in.,2015-10-04T04:25:39 -06:-30,-52.664277,-63.353969,"adipisicing,laborum,aute,mollit,labore,fugiat,proident"
5aa252be36a7e1a936506cd5,32,37,brown,Castro Hill,male,SYNTAC,castrohill@syntac.com,+1 (800) 481-2530,111,Ide Court,Coinjock,South Carolina,100,Enim amet culpa aliqua adipisicing velit nisi laboris fugiat. Do veniam velit in officia. Ipsum fugiat mollit cupidatat exercitation proident. Velit ad fugiat pariatur sit nisi irure aliqua Lorem sint irure fugiat nisi magna.,2015-04-05T10:08:12 -06:-30,-77.396879,73.74492,"qui,mollit,occaecat,amet,deserunt,sint,non"
5aa252be508b8223bf422e00,33,40,brown,Rhoda Pugh,female,GEEKULAR,rhodapugh@geekular.com,+1 (822) 553-2936,196,Love Lane,Iola,Oregon,102,Minim dolore aliquip adipisicing consectetur ipsum eu aliqua laborum sint ullamco. Cillum pariatur velit officia do velit labore labore est sunt. Veniam consectetur fugiat cillum dolor. Pariatur nisi do dolore proident consequat culpa irure aliqua cillum.,2017-05-31T02:28:08 -06:-30,41.560374,18.489319,"excepteur,veniam,do,aliquip,proident,in,anim"
5aa252be3f9e58b2d860b331,34,38,green,Sadie Alford,female,ACCIDENCY,sadiealford@accidency.com,+1 (908) 446-3903,589,Seigel Court,Gouglersville,Michigan,102,Consequat irure consequat sunt nulla laborum incididunt magna ea. In voluptate minim adipisicing qui culpa laborum sunt veniam qui dolore do proident mollit cillum. Ut non proident veniam laborum voluptate et cillum adipisicing pariatur.,2016-08-23T10:30:33 -06:-30,86.920371,65.359024,"sunt,adipisicing,qui,ad,nostrud,duis,nostrud"
5aa252bebe8e987d907d0659,35,32,brown,Heidi Matthews,female,UXMOX,heidimatthews@uxmox.com,+1 (831) 431-3613,988,Sedgwick Street,Marne,Ohio,105,Non labore sit ex incididunt sunt nostrud quis tempor minim proident eiusmod. Excepteur et commodo laboris amet pariatur ad consectetur veniam commodo consectetur. Nostrud anim do aute do dolor officia reprehenderit quis nisi commodo. Adipisicing ea fugiat officia cupidatat reprehenderit irure dolore laborum ullamco ea laborum ea adipisicing occaecat. Aute tempor occaecat voluptate mollit voluptate consectetur ullamco. Officia non aliqua ad incididunt non reprehenderit ipsum consequat pariatur ullamco ipsum.,2017-03-08T09:15:57 -06:-30,-44.380026,-178.349971,"cillum,non,dolore,elit,ex,duis,aute"
5aa252be1a64e1bd46413dc2,36,33,brown,Fuller Montgomery,male,EXTRAGEN,fullermontgomery@extragen.com,+1 (986) 586-3916,716,Diamond Street,Edmund,Wisconsin,105,Culpa do non consequat mollit. Culpa nostrud aute labore elit magna anim aute ullamco labore sit consectetur minim duis nisi. Velit in quis do laboris duis. Non voluptate dolore ad culpa commodo eu in enim eu duis culpa ullamco in ad.,2014-06-04T07:27:41 -06:-30,47.752044,151.890887,"dolor,cupidatat,sint,consequat,nostrud,non,id"
5aa252becb369d85193123cc,37,24,brown,Frances Keith,female,EPLOSION,franceskeith@eplosion.com,+1 (822) 435-3727,889,Thomas Street,Abiquiu,Idaho,110,Tempor cupidatat occaecat laboris deserunt ad labore ad aliquip magna. Lorem dolor tempor fugiat excepteur do culpa nostrud non esse elit laborum ad velit consequat. Ut officia Lorem mollit velit enim enim velit nostrud qui veniam voluptate cillum veniam non. Dolore cillum sit anim cillum velit ullamco nisi tempor eiusmod consequat esse nulla. Quis in incididunt ullamco ea do est pariatur commodo duis occaecat fugiat aliqua consequat. Sunt sit incididunt voluptate pariatur eu aute nisi enim. Reprehenderit nulla officia consequat est nisi sint ut esse nostrud dolore.,2016-01-09T01:22:09 -06:-30,32.231838,-81.910501,"ipsum,ea,aliqua,incididunt,do,consectetur,amet"
5aa252be6e30ebe7ae3fc64a,38,30,brown,Mattie Maynard,female,COWTOWN,mattiemaynard@cowtown.com,+1 (889) 567-2233,723,Beverly Road,Belfair,Texas,109,Consequat occaecat quis adipisicing et sit nisi pariatur voluptate voluptate quis. Lorem ipsum ea nisi consectetur deserunt ut elit incididunt aliqua nisi. Sunt irure nostrud aliquip minim.,2015-07-18T07:23:25 -06:-30,81.752696,61.173588,"excepteur,eu,reprehenderit,dolor,sit,incididunt,et"
5aa252be0458e8cc162bfe33,39,34,brown,Essie Washington,female,METROZ,essiewashington@metroz.com,+1 (907) 586-3014,543,Girard Street,Takilma,Indiana,102,Commodo non irure reprehenderit labore cillum nostrud non consequat quis cillum nisi. Nulla velit laborum mollit fugiat irure ad ea exercitation. Officia ad ullamco irure veniam mollit minim duis amet anim eiusmod duis sint ea. Id officia nisi officia commodo irure aliqua laborum ut velit officia ipsum. Sint sint exercitation qui quis mollit deserunt id eiusmod aliquip est. Tempor aute adipisicing laboris quis reprehenderit officia.,2015-05-31T10:03:30 -06:-30,-63.996195,1.634592,"ad,exercitation,veniam,anim,excepteur,proident,do"
5aa252be9e240ceae4c6ce6e,40,35,brown,Fay Fowler,female,ECRATER,fayfowler@ecrater.com,+1 (906) 554-2928,808,Remsen Street,Northchase,Hawaii,100,Nulla non ut dolor amet quis laborum ex aliquip tempor nulla tempor. Mollit ut id duis amet laborum sint magna nulla fugiat mollit laborum laborum. Dolor aute commodo laboris ea ipsum laborum dolor ad Lorem nisi occaecat deserunt. Ad sit dolor sunt proident.,2016-06-28T01:11:19 -06:-30,0.786986,139.378696,"esse,fugiat,enim,id,aute,magna,nostrud"
5aa252bead855a516fe754ef,41,23,green,Andrea Petersen,female,REMOLD,andreapetersen@remold.com,+1 (973) 452-3174,403,Surf Avenue,Groton,Utah,106,Non officia ea laboris do mollit incididunt aute nulla aliqua cupidatat ad. Amet mollit aliqua fugiat officia labore. Consectetur sint ullamco reprehenderit mollit labore et eu velit magna cupidatat laboris voluptate ullamco.,2017-02-17T04:47:19 -06:-30,-69.977264,97.948624,"cillum,commodo,in,duis,qui,anim,anim"
5aa252beb5aee661a7be5148,42,37,green,Cruz Ayers,male,ZAJ,cruzayers@zaj.com,+1 (963) 424-3617,339,Wortman Avenue,Trucksville,Marshall Islands,101,Sit eu fugiat ad in laborum ad veniam ad. Incididunt est veniam elit cupidatat laboris nostrud pariatur sit cillum. Ut labore laborum irure reprehenderit fugiat exercitation. Minim reprehenderit laboris eu sint veniam sit sit. Excepteur occaecat nisi do velit amet aliquip adipisicing occaecat adipisicing velit excepteur voluptate. Excepteur sint cupidatat cupidatat esse ut duis magna pariatur eu deserunt. Tempor occaecat eiusmod amet esse dolore non elit.,2016-12-19T08:50:03 -06:-30,-7.203596,-152.965251,"consequat,ad,est,excepteur,irure,duis,ad"
5aa252be79860e38c27ed6ec,43,21,green,Wise Preston,male,GENMEX,wisepreston@genmex.com,+1 (900) 535-2349,258,Charles Place,Worcester,Montana,103,Ea velit do in culpa laboris commodo. Sunt deserunt dolore occaecat eu exercitation. Duis ut velit proident nisi sunt ut eu qui et. Quis eu do officia tempor ullamco ut. Cillum est laboris minim officia tempor cupidatat magna eiusmod eiusmod nisi nisi ullamco est. Mollit velit anim eiusmod ut ex veniam aliqua non. Laboris est duis sunt mollit duis in irure adipisicing aute exercitation irure quis deserunt magna.,2015-05-05T12:57:45 -06:-30,-46.872297,-99.948971,"est,magna,id,tempor,pariatur,esse,Lorem"
